recovery,回復,名詞,Though the doctor did his best， the patient's recovery was slow.,医者は最善を尽くしたが患者の回復は思わしくなかった。
reduction,削減,名詞,We would ask you to give us a price reduction of 5%.,それを５％値引きしていただけますか。
region,地域,名詞,The South East region of England is densely populated.,英国の南東区は人口密度が高い。
registration,登録,名詞,Fill out this registration card， please.,この宿泊カードに記入して下さい。
relief,除去；安心；救助,名詞,You have to raise funds for the relief work.,君はその救済事業の資金を集めなければならない。
representation,表現,名詞,This painting is a representation of a storm at sea.,この絵は海の嵐を描いたものである。
representative,代表者，代表する,名詞,Are your opinions representative of those of the other students?,君の意見が他の生徒の意見を代表しているのかね。
requirement,必要条件,名詞,So friendship is also a requirement for happiness.,友情も幸せに必要だってことでしょうか。
researcher,研究者,名詞,The researcher suggested promising directions for treating the cancer.,研究者が癌を治療するための有望な方向性を指し示した。
resistance,抵抗；耐性,名詞,We are faced with the alternative of resistance or slavery.,我々は抵抗か隷属かの二者択一を迫られている。
restaurant,レストラン,名詞,I found that restaurant by accident.,偶然そのレストランを見つけた。
retirement,引退；退職,名詞,Such a judge should retire from his job before retirement age.,こんな裁判官は、定年より前に引退する方がよい。
role,役割,名詞,Mary played the role of an old woman in the play.,メアリーはその劇で老婆の役を演じた。
roof,屋根,名詞,We got our roof blown off in the gale.,強風で屋根を吹き飛ばされた。
root,根；根元，根付かせる；根こそぎにする,名詞,Money is the root of all evil.,金銭はすべてのあくの根である。
sake,為；目的；利益,名詞,Let's not argue for the sake of arguing.,議論のために議論をするのはよそう。
salary,給料,名詞,The salary of a teacher is lower than that of a lawyer.,教師の給料は弁護士よりも低い。
sale,販売；売上高,名詞,Concert tickets are on sale at this office.,演奏会の切符は当事務所で販売しています。
salt,塩,名詞,I seasoned the fish with salt and pepper.,魚に塩とこしょうで味をつけた。
sand,砂,名詞,Dry sand absorbs water.,乾いた砂は水を吸い込む。
scale,目盛り；基準；尺度；縮尺比；規模,名詞,I want a map of Texas on a scale of 1 to 250000.,テキサス州の縮尺、２５万分の１の地図がほしいのですよ。
scene,現場；場面,名詞,A big crowd gathered at the scene of the fire.,火事場はやじ馬で大変だった。
screen,画面，上映する；検査する；選抜する；隠す,名詞,A screen divided the room into two.,ついたてで部屋が２つに分かれている。
season,季節,名詞,The dry season there will set in soon.,間もなくそこでは乾季に入るだろう。
section,部分；区間,名詞,The top favorites of each section were gathered together.,各部門の優勝候補が集まった。
seed,種子,名詞,Bad seed must produce bad corn.,悪い種から必ず悪い実ができる。
selection,選択,名詞,It offers a mouth-watering selection of delights.,よだれの出そうなものがよりどり見どりでいっぱいありますよ。
sentence,文,名詞,All you have to do is to learn this sentence by heart.,君たちはこの文を暗記しさえすればよい。
september,9月,名詞,By September the burst in spending seemed to be tapering off.,九月までには爆発的消費は下り坂になるように見えた。
series,連続,名詞,A series of blasts reduced the laboratory to ruins.,一連の爆発で、その研究施設は瓦礫の山と化した。
shade,日陰,名詞,The sky is a hazy shade of winter.,空はどんよりとした冬の陰にかすんでいる。
shadow,影,名詞,There's a blind man looking for a shadow of doubt.,疑惑の影を捜そうとする盲人。
sheep,羊,名詞,We cannot separate the sheep from the goats by appearance.,外見で、善人と悪人を区別することはできない。
sheet,枚；用紙；シート,名詞,Bring me a sheet of paper， please.,どうか紙を１枚持ってきてください。
shelf,棚,名詞,Put the book back on the shelf when you're through with it.,その本を読み終えたら本棚に戻しておきなさい。
shell,貝殻,名詞,I found a beautiful shell on the shore.,私は岸辺で美しい貝殻を見つけた。
shelter,避難所；保護施設,名詞,The homeless sought shelter from a shower.,家の無い人々は夕日の雨宿りをする場所を探した。
shock,ぎょっとさせる，激突；ショック,名詞,It was a great shock to me.,それは僕には大変なショックだった。
shore,岸,名詞,Our boat drifted to shore on the tide.,我々の船は潮によって岸へ押し流された。
shower,シャワーを浴びる；浴びせる；たくさん与える,名詞,I usually take a shower in the evening.,私はたいてい夕方シャワーを浴びます。
silence,静けさ,名詞,I take it from your silence that you are not satisfied with my answer.,君が黙っているのを見ると私の答えでは不満なのだね。
silver,銀,名詞,Can you distinguish silver from tin?,銀とブリキの区別がつきますか。
sink,流し,名詞,The situation has come to the point where we either sink or swim.,のるかそるかの瀬戸際まできた。
site,ウェブサイト,名詞,The committee picked the site for the exhibition.,委員長は博覧会の会場を見つけた。
ski,スキー,名詞,Roy practiced very hard to get his ski instructor's license.,ロイはスキーの指導員の免許をとるためにとても一生懸命に練習しました。
skill,熟練；技術,名詞,She has improved her skill in cooking recently.,近ごろ彼女の料理の腕が上がった。
skirt,スカート,名詞,Which skirt do you like?,どのスカートがお好みですか。
slave,奴隷,名詞,I refuse to be treated like a slave by you.,君に奴隷のような扱いをされるなんて、まっぴらだ。
society,社会,名詞,The society made him president.,協会は彼を会長にした。
soil,土壌,名詞,The air is soft， the soil moist.,空気は穏やかで、土には湿り気がある。
soldier,兵士,名詞,The soldier acted bravely.,その兵士は勇敢に振る舞った。
soul,魂,名詞,Brevity is the soul of wit.,簡潔は機知の精髄。
species,種,名詞,The lion and the tiger are two different species of cat.,ライオンと虎は猫科の２つの違った種である。
speech,話；スピーチ,名詞,What if you gave a speech and nobody came?,君が演説をして誰も来なかったらどうするの？
speed,速さ，急ぐ；加速する,名詞,We should observe the speed limit.,我々は制限速度を守らなくてはならない。
spirit,精神；気分；気力,名詞,The spirit is willing， but the flesh is weak.,心熱けれど肉体は弱し。
stability,安定,名詞,The authorities managed to stabilize the currency.,当局は自国の通貨を何とか安定させた。
staff,職員，職員を配置する,名詞,Fortune is the rod of the weak， and the staff of the brave.,鬼に金棒。
stair,階段,名詞,What narrow stairs!,なんて狭い階段なんだ！
stamp,切手,名詞,Put this stamp on the postcard and drop it in the mailbox.,はがきにこの切手を貼って郵便箱に投函しなさい。
steel,鋼,名詞,Your name was given to us by Mr. Hayashi of Keiyo Steel Corporation.,京葉鉄鋼の林様よりご紹介いただきました。
stock,在庫；蓄え，仕入れる；満たす,名詞,Improving corporate performances are behind the stock market recovery.,企業業績の改善は株式市場の回復が背景にある。
stomach,胃,名詞,My stomach is clenched with hunger.,空腹でおなかがぺしゃんこだ。
storm,嵐,名詞,The brightness of the sky showed that the storm had passed.,空が明るくなったのであらしが通り過ぎたことが分かった。
stream,流れる,名詞,A small stream ran down among the rocks.,岩の間を小さな小川が流れている。
strength,力；強さ,名詞,I don't have the strength to keep trying.,私にはやり続けるだけの強さがない。
string,糸；ひも,名詞,Pull the string and the water flushes.,ひもを引けば水が流れ出る。
style,様式,名詞,The hair style of the Beatles created a sensation.,ビートルズの髪型はセンセーションを引き起こした。
success,成功,名詞,Your success excites my envy.,君の成功は全くうらやましい。
sugar,砂糖,名詞,Please put a lump of sugar in my coffee.,角砂糖を１個コーヒーに入れて下さい。
supplier,供給者,名詞,We face competition from foreign suppliers.,我々は海外の業者からの競争に直面している。
survival,生き残り,名詞,This is an example of the survival of the fittest， as it is called.,これはいわゆる適者生存の例である。
swing,ブランコ,名詞,The swing is moving up and down.,ぶらんこが上下に動いている。
switch,スイッチ,名詞,You must switch off the power before checking the circuit.,回路を調べる前に、電源のスイッチを切りなさい。
tale,物語,名詞,The tale is familiar to us.,その物語はおなじみである。
tank,タンク,名詞,The tank has a capacity of fifty-gallons.,タンクの容量は５０ガロンだ。
taxi,タクシー,名詞,I got a taxi in front of the station.,駅前でタクシーを拾った。
technology,科学技術,名詞,Why didn't modern technology develop in China?,近代科学技術はなぜ中国で発展しなかったのだろうか。
teenager,ティーンエイジャー；１０代の若者,名詞,A teenager sometimes acts like a baby.,ティーンエイジャーはたまに赤ん坊のような行動をとる。
tension,ピンと張ること；緊張,名詞,The specialist predicts international tension will build up.,その専門家は国際緊張が高まっていくと予測している。
tent,テント,名詞,In the tent we talked and talked.,テントの中で明け方まで延々とおしゃべりをしました。
theater,劇場,名詞,You cannot take a picture in the theater without permission.,許可なく劇場内で写真を撮ることはできません。
threat,脅し,名詞,A promise given under a threat is worthless.,脅迫のもとになされた約束は無効だ。
ticket,切符；チケット,名詞,This ticket entitles you to a free meal.,君はこの券で無料で食事ができる。
tip,内密情報；ヒント，内報する；予想する,名詞,It's on the tip of my tongue.,言葉はのどまで出かかってるんだけど。
title,称号,名詞,His official title at the company is Assistant to the President.,会社での彼の正式な肩書きは社長補佐である。
tone,口調、調子,名詞,The article's tone was one of pessimism.,記事の論調は一種の悲観論だった。
tongue,舌,名詞,Linda stuck her tongue out.,リンダはぺろりと舌を出した。
tool,道具,名詞,We need a tool to open it with.,それを開ける道具が必要です。
topic,話題；トピック,名詞,That topic is too intimate to share with casual acquaintances.,たまたま知り合った人達と話すにしてその話題は立ち入りすぎている。
tour,旅行,名詞,Is there a tour guide available?,観光ガイドは雇えますか。
tourism,観光,名詞,Tourism generated many new jobs.,観光が多くの新しい仕事を生み出した。
tourist,観光客,名詞,Kyoto depends on the tourist industry.,京都は観光産業に依存している。
tower,塔；タワー,名詞,Do you know how high the television tower is?,君はあのテレビ塔の高さがどれくらいあるか知っていますか。
tradition,伝統,名詞,That old tradition has disappeared.,その昔からの伝統はすたれてしまった。
traffic,交通,名詞,There was an enormous traffic jam in downtown Kyoto.,京都の繁華街は交通渋滞がすごかった。
trap,わな，わなで捕える,名詞,We set a trap to catch a fox.,私たちは狐を捕まえるためにわなをしかけた。
trial,裁判；審理,名詞,Finding a solution that worked was a process of trial and error.,解決策が功を奏したのは試行錯誤の結果だった。
truck,トラック,名詞,Look out! There's a truck coming!,危ない！トラックが来るぞ！
tune,曲；音調,名詞,The tune was not familiar to me.,わたしはその曲をしらなかった。
twin,双子,名詞,I'd like a twin with an extra bed.,ツインの部屋にエキストラベッドを入れてください。
union,結合；組合；連合,名詞,The Soviet Union took a hostile attitude toward us.,ソ連はわが国に対して強い態度をとった。
unit,単位；部署,名詞,The company plans to close its U.S. sales unit in New York.,会社はニューヨークにあるアメリカ販売子会社を閉鎖する計画だ。
university,大学,名詞,I can't stand to take another university entrance exam!,また大学の入学試験を受けるなんてやだ。
valley,谷,名詞,A beautiful valley lies behind the hill.,丘の向こう側に美しい谷がある。
variation,変化,名詞,The reason for this is that we found no variation of those morphemes.,このことの理由は、それらの形態素に変異形がまったく見出されなかったからである。
vegetable,野菜,名詞,Tom ate vegetable soup this morning.,トムは今朝、野菜スープを飲んだ。
vehicle,乗り物,名詞,The police pursued the stolen vehicle along the motorway.,警察は盗難車を追って高速道路を走った。
version,版；バージョン,名詞,You must request the latest version of the software.,あなたは新しいバージョンのソフトウェアを要求すべきである。
victim,被害者；犠牲者,名詞,The tarantula seized its victim very quickly.,タランチュラはそのいけにえを素早く捕まえた。
village,村,名詞,I reached the village before dark.,暗くならないうちにその村に着いた。
voter,投票者,名詞,a casting voter,決定投票者
wage,賃金,名詞,The union was modest in its wage demands.,その組合の賃上げ要求は穏当だった。
weakness,弱さ,名詞,The weakness of vinyl is that it is easily affected by heat.,ビニールは熱に弱いのが難点だ。
weapon,武器,名詞,The fingerprints left on the weapon correspond with the suspect's.,凶器に残された指紋は容疑者のものと一致する。
welcome,ようこそ，歓迎，歓迎する,名詞,You are welcome to do anything you like.,君は勝手に好きな事をしてよろしい。
wing,翼,名詞,I found a bird whose wing was severely damaged.,羽に深い傷を負った小鳥を見つけました。
wire,針金；ワイヤー,名詞,Send a wire to your father right now.,お父さんにすぐ電報を打ちなさい。
witness,目撃者，目撃する,名詞,I happened to witness the bullying in the corridor.,偶然、廊下でいじめを目撃した。
wound,傷，負傷させる,名詞,The nurse wound my leg with a bandage.,看護婦さんが私の足に包帯を巻いてくれた。
abortion,流産；中絶,名詞,The independent candidate took the abortion issue off his platform.,その無所属候補者は中絶問題を公約からはずしました。
absence,不在；欠席；不足,名詞,The teacher was worried by Tom's frequent absence from class.,教師はトムのたび重なる欠席を心配した。
academic,学者； 大学教授,名詞,Debate is an academic game between the affirmative and the negative.,ディベートとは肯定側と否定側で交わされる知的ゲームである。
accommodation,宿泊施設,名詞,The hotel has accommodation for one hundred.,そのホテルには１００人を収容する施設がある。
achievement,達成；成果,名詞,His achievements were acknowledged.,彼の功績は認められた。
acquisition,獲得；買収,名詞,Matt is a powerful acquisition for our team.,マットは我々のチームの強力な新メンバーだ。
adjustment,適応,名詞,You can adjust the seat height by moving the adjustment lever up.,調節レバーを上に上げると座面の高さを調節できます。
administration,管理,名詞,Our school administration decided to do away with that school rule.,学校当局はその校則を廃止することに決定した。
agency,代理店,名詞,Does she come from the agency that sent the last temporary I had?,この娘はこの前のバイトをよこした代理店から送られてきたのか。
agenda,議題;  政策;  方針,名詞,The agenda for the meeting has been distributed.,会議の議題が配布された。
aim,目指す;  狙う;  銃や矢を～に向ける,名詞,We must achieve our aim at any price.,我々はいかなる犠牲をはらっても目標を達成せねばならぬ。
aircraft,航空機,名詞,That aircraft company deals in freight only.,その航空会社は貨物のみを扱っている。
airline,航空会社,名詞,Corsairfly is an airline based in Paris.,コールセルフライはパリに本拠を置く航空会社です。
album,(写真の)アルバム,名詞,The album will have been completed by next July.,そのアルバムは次の７月までには完成されているだろう。
ally,同盟国,名詞,Let's ally ourselves to that group.,我々はその団体に参加しよう。
alternative,選択肢；代替案,名詞,Is there no alternative to what you propose?,君の提案することのほかに方法はないのか。
amendment,改正,名詞,In accordance with amendments to the Civil Code，,民放の改正に従い、
analysis,分析,名詞,I beg to differ， as I disagree with your analysis of the situation.,君と違ってその状況分析には賛成できないよ。
analyst,分析家；アナリスト,名詞,financial analyst,金融アナリスト
angle,角度,名詞,The angle would be too narrow.,それでは角度が小さすぎよう。
anxiety,不安,名詞,In my anxiety to pass the test， I studied all night.,そのテストに合格したくて、徹夜で勉強した。
approval,賛成；是認,名詞,I would be grateful for your approval of this request.,このお願いをお認めいただけましたら幸いです。
architecture,建築学；建築物,名詞,The architecture in this part of the city is ugly.,市の地区の建物はみな醜悪だ。
assessment,評価（事前評価）,名詞,How do you assess your students?,あなたはどのようにして学生を評価しますか。
asset,資産；貴重なもの,名詞,She will be an asset to the Purchasing Department.,購買部にとって重要な人材になられると思います。
assumption,仮定；憶説,名詞,Your assumption that his death was an accident seems to be wrong.,彼の死は事故だとする君の推定は間違っているようだ。
athlete,スポーツ選手,名詞,The athlete was full of spirit and confidence.,競技者は気迫と自信に満ちていた。
attribute,属性;  特質,名詞,We attribute Edison's success to intelligence and hard work.,エジソンの成功は知性と勤勉との結果でもある。
audience,観客,名詞,The excited audience ran into the concert hall.,興奮した観客はコンサートホールになだれこんだ。
author,著者,名詞,Richard Roberts is the author of numerous books.,リチャード・ロバーツには数多くの著書がある。
barrier,バリア；障壁,名詞,High tariffs have become a barrier to international trade.,高い関税が国際貿易の障害となっている。
behavior,行動,名詞,You have a responsibility to explain that behavior to me.,君はその行為について、僕に説明する義務がある。
belief,信念,名詞,I have a firm belief in his innocence.,僕は彼の無実を堅く信じている。
bias,偏見；バイアス,名詞,The villagers had a bias against any newcomer.,村人達は新参者に対しても偏見を持っていた。
border,境界； 国境,名詞,We camped on the border of the lake.,我々はその湖のほとりでキャンプした。
boundary,境界,名詞,The Rhine is the boundary between France and Germany.,ライン川はフランスとドイツの境界線である。
budget,予算,名詞,Our family budget is in the red.,我が家の家計は赤字だ。
cancer,癌,名詞,The cancer has spread to her stomach.,癌は彼女の胃に移転している。
capacity,能力；容量,名詞,Mr Brown was acting in the capacity of ambassador.,ブラウン氏は大使の資格で行動していた。
carbon,炭素,名詞,Trees give off oxygen and absorb carbon dioxide.,樹木は酸素を排出し、二酸化炭素を吸収する。
catalog,カタログ,名詞,Our catalog will be sent on demand.,ご請求次第カタログをお送りします。
category,部門；カテゴリー,名詞,The category of a hurricane depends on its wind speed.,ハリケーンの種類は風速によって決まります。
celebration,お祝い,名詞,Please accept this gift for the celebration on your wedding.,結婚のお祝いに、これをお贈りします。
cell,携帯電話,名詞,How can you have a laptop and not a cell phone?,どうしてノートパソコンは持っているのに携帯電話は持っていないの？
ceremony,儀式,名詞,The ceremony began with his speech.,式典は彼の話から始まった。
chairman,議長； 会長,名詞,The chairman rejected his absurd proposal.,議長は彼のばかげた提案を拒絶した。
chamber,部屋；評議会,名詞,We visited the king's main chamber in the castle.,私たちはその城の中にある王の間を訪れた。
charity,慈善団体,名詞,The opera singer held a charity concert of his own accord.,オペラ歌手は自発的にチャリティーコンサートを開いた。
chart,図表,名詞,The chart illustrates how the body works.,その図は体の働きを説明している。
chemical,化学の，化学製品,名詞,Immediately after it caught fire， the chemical factory blew up.,火がつくとすぐに、その化学工場は爆発した。
civilian,民間人,名詞,I'm a civilian.,私は一般人です。
clause,条項,名詞,The clause provides that all decisions shall be made by majority vote.,その条項は、議決はすべて過半数をもって成立すると規定している。
climate,気候,名詞,The climate has much to do with our mind and body.,気候は我々の心身に大きな関わりを持っている。
code,符号；コード,名詞,Can you tell me what the zip code is for New York?,ニューヨークの郵便番号を教えていただけますか。
coin,硬貨,名詞,The gold coin was much more valuable than was supposed.,金貨は思ったよりはるかに価値があった。
colleague,同僚,名詞,My colleague doctored the report.,私の同僚は報告書を改ざんした。
column,コラム;  囲み記事,名詞,The geyser sends up a column of hot water every two hours.,間欠泉は２時間毎に湯を噴出する。
comedy,コメディー,名詞,As a rule， I prefer a comedy to a tragedy.,概して私は悲劇よりも喜劇が好きだ。
commission,委員会,名詞,The commission concluded that the answer was no.,委員会は反対という結論を出した。
communication,コミュニケーション；通信,名詞,Their communication may be much more complex than we thought.,彼らのコミュニケーションは我々が考えてきたものよりはるかに複雑かもしれません。
compensation,補償,名詞,He received a large sum of money in compensation for his injury.,彼は怪我の賠償として多額の金を受け取った。
competitor,競争相手,名詞,The competitor twice jumped the gun.,あの選手は２回もフライングをした。
complaint,苦情,名詞,Do you have any complaint about it?,それについて何か不服があるのですか。
complexity,複雑さ,名詞,behaviour of such complexity derives entirely from instinct.,そのような複雑さの振る舞いは、完全に本能に由来します。
composition,構成；組成；合成物；作文；作曲,名詞,You'll have this composition written by noon tomorrow， won't you?,君はこの作文を明日の正午までには書いてしまっているだろう。
compound,合成物； 化合物， 合成された,名詞,The pain from the compound fracture was almost intolerable.,複雑骨折の痛みはほとんど耐え難かった。
concept,概念（組織的な）,名詞,The concept is quite alien to our way of thinking.,その考えは私たちの考えとまったく相いれないものだ。
concert,コンサート,名詞,I would like to go to the concert with you.,君とコンサートに行きたい。
conclusion,結論；締結,名詞,Your conclusion is highly arguable.,君の結論には議論の余地がたくさんある。
concrete,コンクリート， コンクリートで固める ,名詞,A committee should apply the focus to the more concrete problem.,委員会はもっと具体的な問題に焦点を当てるべきだ。
confidence,自信,名詞,Tom lacks confidence in himself.,トムは自分に自信がない。
