ability,能力,名詞,He has the ability to do the work.,彼にはその仕事をこなす能力がある。
account,(預金)口座,名詞,I do not have an account in these forums.,これらのフォームのアカウントを私はもってません。
action,行動,名詞,Your motive was admirable， but your action was not.,君の動機は立派であったが行動はそうではなかった。
addition,追加,名詞,We are expecting an addition to our family.,我が家はもう一人増えそうです。
address,住所； アドレス,名詞,Write your address here.,君の住所をここにお書きなさい。
advertisement,広告,名詞,The job advertisement specifically requested females.,求人広告には「女性を求む」とはっきり書かれていた。
afternoon,午後,名詞,I spent the whole afternoon chatting with friends.,午後はずっと友人とおしゃべりをして過ごした。
age,年齢,名詞,You must take his age into account.,君は彼の年齢を考慮に入れなければならない。
agreement,合意；協定；一致,名詞,There is very little probability of an agreement being reached.,協定が結ばれる可能性は極めて少ない。
air,空気,名詞,To live without air is impossible.,空気無しで生きることは不可能です。
amount,量；総計，合計に達する；結局～なる,名詞,You'll be paid according to the amount of work you do.,君の賃金は仕事量に応じて支払われる。
animal,動物,名詞,Cows are more useful than any other animal in this country.,牛はこの国では他のどんな動物よりも役に立つ。
answer,答え,名詞,You'll have to answer for your behavior.,君は自分の行動に対して責任を取りなさい。
anything,（疑問文で）何か，（否定文で）何も，（肯定文で）何でも,名詞,I won't ask you anything else today.,今日はもう聞かないよ。
appearance,外観；出現；状況,名詞,To all appearance his statement was true.,どう見てもあの人の言ったことは真実のようだ。
area,地域；場所,名詞,It is risky for you to go into that area alone.,君が一人でその地域に行くのは危険だ。
arm,腕,名詞,I have a very sore arm where you hit me.,君にたたかれた腕の所がとても痛い。
arrival,到着,名詞,Our arrival at Narita was delayed by an hour.,我々の成田空港到着は１時間遅れた。
art,芸術,名詞,Karate is an art of unarmed defense.,空手は武器を用いない護身術である。
artist,芸術家；アーティスト,名詞,The artist captured the charm of the lady.,画家はその婦人の魅力をうまく捕らえた。
autumn,秋,名詞,In late summer and autumn one can see the leaves change colour.,夏の末と秋には紅葉が見られる。
awareness,認識,名詞,Developing political awareness takes time.,政治的意識を持つようになるには時間がかかる。
baby,赤ん坊,名詞,This baby penguin is too cute!,この赤ちゃんペンギンとっても可愛い！
bag,かばん；バッグ；袋,名詞,The robber seized the bag from his hand.,強盗はそのかばんを彼の手から奪い取った。
ball,ボール；球,名詞,The ball rolled into the stream.,球は小川の中に転がり込んだ。
bank,銀行,名詞,You can bank on that.,君はそれを当てにできる。
bath,浴槽,名詞,Soon the bath was cool enough for him to get into.,間もなく風呂は彼が入れるほどぬるくなりました。
beach,砂浜,名詞,A short stroll along the beach gave me a good appetite for breakfast.,海岸を少し散歩したら、朝御飯をとても食べたくなった。
bear,熊,名詞,Your efforts will bear fruit someday.,君の努力はいつかは実を結ぶだろう。
beauty,美人,名詞,The charm of Kyoto consists of the beauty of its old temples.,京都の魅力は古い寺の美しさにある。
bed,ベッド,名詞,It would be better for you to stay in bed today.,君は今日寝ていたほうがよさそうだ。
bill,請求書,名詞,I'll bring you the bill immediately.,すぐに伝票をお持ちします。
bird,鳥,名詞,The early bird catches the worm.,朝起きは三文の徳。
birth,誕生,名詞,The town gave birth to many men of note.,その町は多くの有名人を生んだ。
bit,少し；部分,名詞,With so many people around he naturally became a bit nervous.,多くの人に囲まれて彼は自然と少し緊張しだした。
blood,血,名詞,Parents who beat their children really make my blood boil.,我が子をたたく親には本当に憤慨させられる。
boat,ボート；船,名詞,I want a boat that will take me far away from here.,ここから遠くまで行けるボートが欲しいです。
body,体；人,名詞,I'm keeping a record of basal body temperature.,基礎体温をつけています。
bone,骨,名詞,I have a bone to pick with you.,あなたに不満があります。
book,本,名詞,Take a book and read it.,本を取ってそれを読みなさい。
bottle,ボトル；瓶,名詞,Find an empty bottle and fill it with water.,空のビンを捜して水を入れなさい。
bottom,底,名詞,Gum got stuck to the bottom of my shoe.,靴の底にガムが付いてしまった。
box,箱；ボックス,名詞,You may take either the big box or the small one.,君は大きい箱か小さい箱のどちらかをとっていいよ。
boy,男の子,名詞,Hunger compelled the boy to steal money from the cash register.,空腹のためにその少年はやむなくレジからお金を盗んだ。
bread,パン,名詞,Do you have bread for lunch?,君は昼食にパンを食べますか。
breakfast,朝食,名詞,We have breakfast at seven.,我々は７時に朝食をとる。
breath,息；呼吸,名詞,I'm out of breath after running up the stairs.,階段を駆け上がったので、息が切れた。
brother,兄弟；仲間,名詞,My little brother is watching TV.,私の弟はテレビを見ている。
bus,バス,名詞,Where can I get a shuttle bus at the airport?,空港リムジンバス乗り場はどこですか。
business,会社、仕事,名詞,You have no business complaining about the matter.,君はその事に不平を言うことはないよ。
buyer,買い手,名詞,They still haven't found a buyer for that house.,あの家はまだ買い手がつかない。
cake,ケーキ,名詞,Your cake is delicious.,君のケーキはおいしいね。
camp,キャンプ,名詞,We found it very hard going back to our base camp in the blizzard.,我々は吹雪の中をベースキャンプに戻るのに苦労した。
car,車,名詞,The car crashed into the wall.,その車は壁にぶつかった。
card,カード,名詞,There is a card on the desk.,机の上に一枚のカードがある。
case,場合,名詞,You have to judge the case without bias.,君はその問題を公正に判断しなければならない。
cat,猫,名詞,I feed my cat every morning and every evening.,毎日朝と夜、猫に餌を与えています。
center,中心,名詞,The tourist information center gave a city map to whoever asked it.,観光案内所では、ほしい人には誰にでも町の地図をあげました。
chair,椅子,名詞,Your chair is identical to mine.,君のいすは私のと全く同じだ。
chance,機会；可能性；偶然,名詞,Any chance you know where I put my keys?,私はカギを置いたところなんか知りませんか。
chicken,ニワトリ,名詞,Roast chicken is one of my favorite dishes.,ローストチキンは大好きな料理の１つです。
child,子ども,名詞,You are not a child any more.,君はもう子供ではない。
childhood,子供時代,名詞,Yumiko married a childhood friend last June.,ゆみこはこの前の６月に、子供時代の友人と結婚した。
choice,選択,名詞,You have no choice in this matter.,君はこの件については選択の自由はない。
church,教会,名詞,We could hear the donnnng ... donnnng of the church bells nearby.,近くの教会からカーンカーンという鐘の音がしてきた。
city,市；都市,名詞,Paris is the most beautiful city in the world.,パリは世界で最も美しい街である。
class,階級； ランク;授業,名詞,You never have class or what?!,授業が全然無いとでも言うの？！
clock,時計,名詞,The clock in the church tower struck nine.,教会の塔の時計が９時を打った。
clothes,衣服,名詞,I'm just sorting out some suitable clothes to take on holiday.,休日に着る手頃な着物を今選んでいるところです。
clothing,衣類,名詞,Food， clothing and shelter are the basis of life.,衣食住は生活の基本です。
club,クラブ； 同好会； 会員制組織， ,名詞,You may as well withdraw from the club right away.,君は直ちにクラブを脱退したほうがよい。
coat,上着;  コート,名詞,The button on your coat is coming off.,君の上着のボタンがとれかかっているよ。
coffee,コーヒー,名詞,Let's have some coffee during recess.,休憩の間にコーヒーを飲みましょう。
collection,収集物(品);  コレクション,名詞,Science is far more than a collection of facts and methods.,科学は単に事実と方法論の集積では決してない。
college,大学；（米）単科大学,名詞,Which college are you aiming for?,君はどこの大学を目指しているのですか。
color,色,名詞,Choose the color you like the best.,君が最も好きな色を選びなさい。
comfort,快適さ； 安楽,名詞,The nurses must see to the comfort of their patients.,看護婦は患者の快適さに配慮しなくてはいけない。
company,会社,名詞,You had better not keep company with him.,君は彼と交際しない方がよい。
computer,コンピュータ,名詞,My computer has got to be useful for something.,私のパソコンは何かの役に立つはずだ。
concern,心配； 懸念,名詞,Excessive concern with safety can be dangerous.,安全にあまりにも気を使いすぎると危険なこともあります。
consideration,考慮事項,名詞,You had better take into consideration that you are no longer young.,君は自分がもはや若くないことを考慮に入れたほうがいい。
conversation,会話;  対談,名詞,Wit is to conversation what salt is to food.,会話にとって機知は食物に対する塩のようなものである。
corner,コーナー；角；地域；窮地,名詞,The man in the corner addressed himself to the husband.,隅にいた男の人が夫に話しかけた。
cost,費用,名詞,This will cost €30.,３０ユーロになります。
country,国,名詞,Why don't we drive out to the country for a change of pace?,気分転換に田舎にドライブに行かないかい。
couple,ペア；カップル,名詞,Could you lend me your bicycle for a couple of days?,君の自転車を２、３日貸してくれませんか。
course,方向;  進路,名詞,You insist upon our taking that course of action.,君は私たちにそう行動せよという。
court,(テニスなどの)コート,名詞,We went to court when they refused to pay for the damage.,我々は彼らが損害賠償を拒んだので告訴した。
cover,蓋;  覆う,名詞,Will this cover the holiday expenses?,休み中の費用は、これで足りるかな？
coverage,報道,名詞,There's no cellphone coverage in this area.,この地域は携帯電話の圏外だ。
crime,犯罪,名詞,He committed one crime after another.,彼は悪事を重ねた。
cup,カップ,名詞,I'm glad you enjoy skiing， but I guess it's just not my cup of tea.,君がスキーを楽しむのは嬉しいが、私の趣味じゃないようだ。
danger,危険,名詞,You are secure from danger here.,君はここなら安全だ。
darkness,暗さ；黒さ,名詞,The darkness has not overcome it.,闇はこれに打ち勝たなかった。
date,日付,名詞,We will let you know the time and date of the meeting soon.,会合の日時はおってお知らせします。
daughter,娘,名詞,Your daughter is not a child anymore.,君の娘はもう子供ではない。
day,日,名詞,"Why does one say ""Good day"" when the day is not good?",なぜ、早くないのに、「お早う」というのでしょう？
dealer,販売業者,名詞,We have come to an arrangement with the dealer about the price.,我々は価格について業者と相談がまとまった。
death,死；死亡,名詞,Students discussed the problem of brain death for a long time.,学生たちは脳死の問題について長々と議論した。
degree,度;  程度；レベル,名詞,They are different in degree but not in kind.,それらは程度の差で本質的には違いはない。
depth,深さ,名詞,To weep is to make less the depth of grief.,泣くことは悲しみを和らげる。
difference,相違,名詞,There is a fundamental difference between your opinion and mine.,君と私の意見には基本的な違いがある。
difficulty,難しさ；困難,名詞,You'll have some difficulty in carrying out the plan.,君はその案を実行するのに少し苦労するだろう。
dinner,夕食,名詞,During summer breaks， I ate dinner at midnight.,夏休みの間、私は夜中に夕食を食べていた。
discovery,発見,名詞,Scientists regard the discovery as important.,科学者たちはその発見を重大なことだと考えている。
dog,犬,名詞,Didn't you see a dog pass through the yard?,君は犬が庭を通り抜けて行くのを見なかったかい。
door,ドア,名詞,Close the door when you leave.,去る時はドアを閉めてください。
doubt,疑い,名詞,I don't for a moment doubt your honesty.,君の正直なのを決して疑いはしない。
dream,夢,名詞,Do you ever dream about flying through the sky?,君は空を飛ぶ夢を見る事がありますか。
dress,ドレス；ワンピース；服装,名詞,Your dress is unsuitable for the occasion.,君の服装は場所にそぐわない。
driver,運転手,名詞,The load was too heavy for a driver to carry alone.,荷物は重すぎて運転手は１人では運べなかった。
drug,薬,名詞,The new drug will be tested in Vaxgen's laboratory.,バクスゲン社の研究所で新薬の試験が行われた。
ear,耳,名詞,You really have an ear for music.,君は音楽がよくわかるね。
earth,地球,名詞,What on earth did you take me for?,君は私を一体なんだと思っていたのだ。
east,東,名詞,The strong east wind lashed at our faces.,強い東風が我々の顔に激しく吹き付けた。
edge,端；ふち,名詞,I've been on edge recently.,近頃いらいらしています。
egg,卵,名詞,It's so hot that you could cook an egg on the hood of a car.,とても暑くて、車のボンネットで卵が焼けるよ。
employee,従業員,名詞,The outraged employee resigned at once.,かんかんに怒った社員は、即刻会社を辞めた。
employer,雇用主,名詞,Tim's employer promised him pie-in-the-sky benefits.,ティムの社長はあてにならないもうけ話をティムに約束した。
employment,雇用,名詞,Workers are taking a financial beating in the employment crisis.,雇用危機の中で労働者は金銭的打撃を受けています。
engine,エンジン,名詞,The engine has broken down again.,またエンジンが故障した。
evening,夕方；晩,名詞,He spent the evening reading a book.,彼は夕方本を読んで過ごしました。
excitement,興奮；刺激,名詞,The excitement reached its peak.,興奮は極点に達した。
expectation,予想；期待,名詞,Sorry to say， that expectation was ill-founded.,残念ながらその予想は外れてしまった。
experience,経験,名詞,Have you had any experience with this kind of work?,君はこういう仕事に経験がありますか。
explanation,説明,名詞,Your explanation won't wash; it's too improbable to be true.,君の説明は見えすいている。とても本当とは思えないよ。
expression,表現；表情,名詞,Crying is an expression of grief.,泣く事は悲しみの表現だ。
eye,目,名詞,An eye for an eye， a tooth for a tooth.,目には目を、歯には歯を。
face,顔,名詞,Half a million children still face malnutrition in Niger.,ニジェールでは50万人もの子供たちが未だ栄養失調に直面している。
fact,事実,名詞,You should make sure of the fact without hesitation.,君はためらわずに事実を確かめるべきだ。
family,家族,名詞,You must be mindful of your family responsibilities.,君は家族扶養の責任を忘れてはならない。
farm,農場,名詞,I delighted in going to his farm during the summer vacation.,夏休みに彼の農場に行くのが楽しみでした。
farmer,農家の人,名詞,The farmer that lived nearby came to investigate.,近所に住む農家が、その事故を見にやって来た。
fat,脂肪,名詞,Two fat men trying to pass through a narrow doorway are in checkmate.,狭い戸口を通り抜けようとする二人の肥った男が行き詰まっている。
father,父,名詞,Have you visited the town where your father was born?,君はお父さんの生まれ故郷を訪ねたことがありますか。
fear,恐れ,名詞,You must conquer your fear of the dark.,君は暗闇の恐怖を克服しなければならない。
field,野原,名詞,We will crop the field with cotton this year.,我々はその畑に今年は綿を植え付けるつもりだ。
fight,けんか；戦い,名詞,Two dogs fight for a bone， and the third runs away with it.,漁夫の利。
film,映画（イギリス英語）,名詞,The film started at 2 o'clock.,映画は2時に始まった。
finger,指,名詞,You want to have a finger in every pie， don't you?,君は何でもかんでも手を出したがる。
finish,終わり,名詞,You yourself have to finish it.,君は自分でそれを完成しなければならない。
fire,火；火事,名詞,Did you hear about the fire yesterday?,昨日の火事のこと聞きました？
fish,魚,名詞,Are you trying to fish in troubled waters?,君は漁夫の利を占めようとしているのか。
floor,床,名詞,She shone her torch onto the floor before us.,懐中電灯をつけて、足元を照らしてくれた。
flower,花,名詞,There is a flower shop near by.,近くに花屋があります。
food,食物,名詞,How do you find food in outer space?,宇宙でどうやって食べ物をみつけるの？
foot,足,名詞,The church is at the foot of the hill.,教会は丘のふもとにある。
football,サッカー,名詞,The Roman football game was like the Greek game.,ローマのフットボールの試合はギリシャのフットボールの試合と似ていました。
forest,森林,名詞,You will see a forest of masts in the harbor.,君は港内に林立する帆柱を見るであろう。
form,形,名詞,You should try to form the habit of using your dictionaries.,君は辞書を引く習慣をつけるべきだ。
freedom,自由,名詞,You have the freedom to travel wherever you like.,君の好きなところへ自由に旅をして良い。
friday,金曜日,名詞,There will be a dance Friday night at the high school.,金曜日の晩に高校でダンスパーティーがある。
friendship,友情,名詞,Your friendship is most precious to me.,君の友情は私にとってとても大切だ。
game,ゲーム,名詞,That game is easy， once you learn the basic rules.,基本ルールを学んでしまえば、そのゲームは簡単です。
garden,庭（イギリス英語）,名詞,Her garden is a work of art.,彼女の庭は芸術作品です。
gas,ガス；気体,名詞,The reporter covered the gas explosion in Shibuya.,記者は渋谷で起きたガス爆発事故を報道した。
girl,女の子,名詞,Do you know where the girl lives?,君はその少女がどこに住んでいるのか知っていますか。
glance,ちらりと見ること,名詞,At a glance I knew that he was tired.,一目見て彼が疲れているのがわかった。
glass,ガラス,名詞,Those who live in glass houses should not throw stones.,こわれやすいガラス張りの家に住む者は石を投げてはいけない。
god,神,名詞,Danger past， God forgotten.,苦しいときの神頼み。
gold,金,名詞,The gold coin was much more valuable than was supposed.,金貨は思ったよりはるかに価値があった。
government,政府,名詞,Why does the US government let people have guns?,なぜアメリカ政府は国民が銃を持つことを許しているのですか。
governor,知事,名詞,The prefectural governor got the upper hand in the July elections.,その県知事は７月の選挙で勝利をおさめました。
grass,草,名詞,Cows are eating grass in the meadow.,牛が牧場で草を食べている。
green,緑色,名詞,The cows were moving very slowly through the long green grass.,牛は背の高い緑色の草の中をゆっくり動いていました。
group,グループ；集団,名詞,A group of foreigners arrived in Edo， i.e. Tokyo.,外国人の一団が江戸、つまり東京に到着した。
growth,成長；増殖；腫瘍,名詞,Fair competition is necessary for the healthy growth of industry.,業界の健全な成長のために公正な競争が確保される必要がある。
gun,銃,名詞,The robber aimed his gun at the clerk.,強盗は店員に銃を向けた。
guy,男；やつ,名詞,This stone-dead guy had no friends.,完全に死んだ人には仲間はいない。
hair,髪；毛,名詞,You should get your hair cut.,髪を切ってもらった方がいいよ。
hall,ホール；会場,名詞,The student hall is for benefit of the students.,学生会館は学生のためにある。
hand,手,名詞,You are to hand in your assignments by Monday.,君たちは月曜日までに宿題を提出しなければいけませんよ。
happiness,幸福；喜び；適切さ,名詞,Wishing you peace and happiness at Christmas.,安らかで幸せなクリスマスを。
hat,帽子,名詞,You must take off your hat in the room.,君は部屋の中では帽子をとらなくてはならない。
head,頭,名詞,The robber bashed her head in.,強盗は彼女の頭をめった打ちにした。
health,健康,名詞,Toil and worry caused his health to break down.,労苦と心配で彼の健康はそこなわれることになった。
heart,心臓,名詞,My heart was filled with happiness.,私の心は幸福感でいっぱいだった。
hell,地獄,名詞,What the hell are you going to do with it?,一体全体、きみはそれをどうしようと言うつもりなのか。
hill,丘,名詞,The church is on the hill overlooking the city.,教会は町を見下ろす丘の上にある。
historian,歴史家,名詞,Professor Suzuki is an expert historian.,鈴木先生は歴史の専門家です。
history,歴史,名詞,I'd like to spend my holidays reading history books or classics.,休日は歴史書か古典を読んで過ごしたいものだ。
holder,所有者,名詞,I'm a holder of ABC Travel Insurance.,ＡＢＣ海外旅行障害保険を持っています。
hole,穴,名詞,There is a big hole in your stocking.,靴下に大きな穴があいてるよ。
holiday,休日；祝日,名詞,I enjoyed the holiday all the better for being with you.,君が一緒だったおかげで休日がいっそう楽しめた。
home,家庭；自宅,名詞,You must go home at once.,君は直ちに家へ帰らなければならない。
hope,希望,名詞,I hope you can come up with a better plan than this.,君はこれより良い計画を考え出すことができると思います。
horse,馬,名詞,It's lonely in the saddle since the horse died.,馬が亡くなってから鞍が淋しい。
hospital,病院,名詞,I had been to the hospital before you came.,君が来る前に病院へ行ってきた。
hour,時間,名詞,You look tired. You ought to rest for an hour or two.,君は疲れた顔をしている。１、２時間休息すべきだ。
house,家,名詞,Ah! If I were rich， I'd buy myself a house in Spain.,ああ！　もし私がお金持ちだったら、スペインに自分の家を買ったのに。
human,人間,名詞,Air， like food， is a basic human need.,空気は食べ物と同様、人間が根本的に必要とするものだ。
hunger,飢え,名詞,With hunger and fatigue， the dog died at last.,空腹やら疲労やらで、その犬はとうとう死んだ。
husband,夫,名詞,Linda's husband was two-timing her.,リンダの夫は彼女を裏切っていた。
ice,氷,名詞,You shouldn't have eaten so much ice cream.,君はあんなにアイスクリームを食べるべきではなかった。
idea,考え；アイデア,名詞,The last person I told my idea to thought I was nuts.,僕が最後に自分の考えを伝えた人は、僕を気違いだと思ったようだ。
imagination,想像力 ,名詞,The music set my imagination to work.,その音楽は私の想像力をかきたてた。
information,情報,名詞,The information you gave me is of little use.,君が僕に教えてくれた情報はあまり役に立たない。
insurance,保険,名詞,Our insurance policy covers various kinds of damages.,我々の保険の範囲は多様な損害に及びます。
involvement,関与,名詞,The newspaper alleged his involvement in the crime.,その新聞は彼の犯罪への掛かり合いを主張した。
island,島,名詞,Seen from the sky， the island was very beautiful.,空から見ると、その島はとても美しかった。
issue,問題；論争点,名詞,Opinions are divided on the issue of taxes.,課税問題で意見が分かれている。
job,仕事,名詞,I like my job very much.,私は自分の仕事を気に入っています。
